{
  "id": "legal.document-header",
  "kind": "section",
  "purpose": "State the document title and effective date.",
  "semantic": {
    "id": "legal.document-header",
    "category": "CONTENT"
  },
  "source": {
    "id": "LegalPage",
    "tag": "h1",
    "file": "src/components/pages/LegalPage.jsx",
    "lines": "168-172",
    "anchor": "Effective date:"
  },
  "retrievalEligible": true,
  "implementedBy": [
    "src/components/pages/LegalPage.jsx"
  ],
  "evidenceLevel": "measured",
  "iaSection": "ia.json:106",
  "variants": [
    {
      "id": "default",
      "description": "H1 plus 'Effective date:' line."
    }
  ],
  "constraints": {
    "onePerPage": true,
    "maxPerPage": 1,
    "allowedTemplates": [
      "template.legal"
    ]
  },
  "content": {
    "type": "object",
    "properties": {
      "title": {
        "type": "string",
        "minLength": 1,
        "x-maxWords": 4,
        "x-observedMaxWords": 3
      },
      "effectiveDateLabel": {
        "const": "Effective date:"
      },
      "effectiveDate": {
        "type": "string",
        "minLength": 1,
        "x-maxWords": 4,
        "x-observedMaxWords": 3
      }
    },
    "required": [
      "title",
      "effectiveDateLabel",
      "effectiveDate"
    ],
    "additionalProperties": false
  },
  "contentBudgetNote": "x-maxWords = ceil(1.25 x observed max words in the real copy), rounded up to an even number (min 2); x-observedMaxWords is the measured maximum. x-maxChars (legal) = observed maximum characters. Enforced per instance by schema/semantic_validate.py.",
  "motion": {
    "schema": {
      "type": "object",
      "properties": {
        "pattern": {
          "const": "static"
        },
        "trigger": {
          "enum": [
            "none"
          ]
        },
        "reducedMotionFallback": {
          "const": "not-applicable"
        }
      },
      "required": [
        "pattern",
        "trigger",
        "reducedMotionFallback"
      ],
      "additionalProperties": false
    },
    "exemplar": {
      "pattern": "static",
      "trigger": "none",
      "reducedMotionFallback": "not-applicable"
    },
    "measuredFrom": [],
    "reducedMotionEvidence": "Generation requirement: reducedMotionFallback is const-locked per section. Where the clone source shows a real prefers-reduced-motion branch it is cited in measuredFrom; otherwise it is a required fallback, not a measured behaviour."
  },
  "fixedInternalContent": [],
  "exemplar": {
    "variant": "default",
    "content": {
      "title": "Privacy Policy",
      "effectiveDateLabel": "Effective date:",
      "effectiveDate": "July 1, 2026"
    },
    "motion": {
      "pattern": "static",
      "trigger": "none",
      "reducedMotionFallback": "not-applicable"
    }
  },
  "notes": [
    "Titles/dates observed: Privacy Policy / July 1, 2026; Terms of Service / April 28, 2026."
  ],
  "measuredFrom": [
    "src/components/pages/LegalPage.jsx:171",
    "CLONE_SPEC_PAGES.md:106"
  ],
  "responsive": {
    "mode": "mobile-first-min-width",
    "breakpointKeys": [
      "base",
      "md"
    ],
    "rules": [
      {
        "at": "base",
        "layout": "h1 32/38.",
        "properties": {
          "h1Px": 32
        },
        "evidence": "measured",
        "measuredFrom": [
          "CLONE_SPEC_PAGES.md:87"
        ]
      },
      {
        "at": "md",
        "layout": "h1 44/52.",
        "properties": {
          "h1Px": 44
        },
        "evidence": "measured",
        "measuredFrom": [
          "CLONE_SPEC_PAGES.md:87"
        ]
      }
    ]
  }
}
