{
  "id": "legal.document-section",
  "kind": "section",
  "purpose": "One heading-bounded part of a legal document: its H2 heading plus the H3 sub-headings, paragraphs, lists and (on /terms) the closing rule up to the next H2. Repeats once per H2. Placeholder copy with the original's structure, not Operate's real legal text.",
  "semantic": {
    "id": "legal.document-section",
    "category": "CONTENT"
  },
  "source": {
    "id": "Block",
    "tag": "h2",
    "file": "src/components/pages/LegalPage.jsx",
    "lines": "129-157",
    "anchor": "case 'h2'"
  },
  "retrievalEligible": true,
  "implementedBy": [
    "src/components/pages/LegalPage.jsx",
    "src/pages/Privacy.jsx",
    "src/pages/Terms.jsx"
  ],
  "evidenceLevel": "measured",
  "iaSection": "ia.json:118",
  "variants": [
    {
      "id": "default",
      "description": "H2 + body blocks in the 768px reading column on #E0E0E0."
    }
  ],
  "constraints": {
    "onePerPage": false,
    "maxPerPage": 14,
    "allowedTemplates": [
      "template.legal"
    ]
  },
  "content": {
    "type": "object",
    "properties": {
      "heading": {
        "type": "string",
        "minLength": 1,
        "x-maxChars": 35,
        "x-observedMaxChars": 35
      },
      "blocks": {
        "type": "array",
        "minItems": 1,
        "maxItems": 23,
        "x-observedMaxItems": 23,
        "items": {
          "type": "object",
          "properties": {
            "type": {
              "enum": [
                "h3",
                "p",
                "ul",
                "ol",
                "hr"
              ]
            },
            "text": {
              "type": "string",
              "minLength": 1,
              "x-maxChars": 1866,
              "x-observedMaxChars": 1866
            },
            "items": {
              "type": "array",
              "items": {
                "type": "string",
                "minLength": 1,
                "x-maxChars": 1248,
                "x-observedMaxChars": 1248
              },
              "minItems": 1,
              "maxItems": 12
            }
          },
          "required": [
            "type"
          ],
          "additionalProperties": false
        }
      }
    },
    "required": [
      "heading",
      "blocks"
    ],
    "additionalProperties": false
  },
  "contentBudgetNote": "x-maxWords = ceil(1.25 x observed max words in the real copy), rounded up to an even number (min 2); x-observedMaxWords is the measured maximum. x-maxChars (legal) = observed maximum characters. Enforced per instance by schema/semantic_validate.py.",
  "motion": {
    "schema": {
      "type": "object",
      "properties": {
        "pattern": {
          "const": "static"
        },
        "trigger": {
          "enum": [
            "none"
          ]
        },
        "reducedMotionFallback": {
          "const": "not-applicable"
        }
      },
      "required": [
        "pattern",
        "trigger",
        "reducedMotionFallback"
      ],
      "additionalProperties": false
    },
    "exemplar": {
      "pattern": "static",
      "trigger": "none",
      "reducedMotionFallback": "not-applicable"
    },
    "measuredFrom": [],
    "reducedMotionEvidence": "Generation requirement: reducedMotionFallback is const-locked per section. Where the clone source shows a real prefers-reduced-motion branch it is cited in measuredFrom; otherwise it is a required fallback, not a measured behaviour."
  },
  "fixedInternalContent": [],
  "exemplar": {
    "variant": "default",
    "content": {
      "heading": "1. Placeholder section",
      "blocks": [
        {
          "type": "p",
          "text": "This section is placeholder text and will be replaced with the final wording before publication."
        },
        {
          "type": "h3",
          "text": "Placeholder subsection"
        },
        {
          "type": "ul",
          "items": [
            "This item is a placeholder.",
            "Specific examples will be listed here."
          ]
        },
        {
          "type": "hr"
        }
      ]
    },
    "motion": {
      "pattern": "static",
      "trigger": "none",
      "reducedMotionFallback": "not-applicable"
    }
  },
  "notes": [
    "Observed: 14 parts on /privacy, 12 on /terms (maxPerPage 14); the longest part is /terms '10. General Terms' with 23 blocks (maxItems 23).",
    "Block type determines required fields: h3/p need text, ul/ol need items, hr takes neither (enforced in schema/semantic_validate.py). The H2 is the `heading` field.",
    "Split out of the former legal.document-body (1.2.0): the wrapper gate measured that one body section held 96-98% of each legal page; each part is now at most 25% of its page."
  ],
  "measuredFrom": [
    "src/pages/Privacy.jsx:21",
    "src/pages/Privacy.jsx:113",
    "src/pages/Terms.jsx:111",
    "src/pages/Terms.jsx:136",
    "CLONE_SPEC_PAGES.md:102",
    "src/components/pages/LegalPage.jsx:173-175"
  ],
  "responsive": {
    "mode": "mobile-first-min-width",
    "breakpointKeys": [
      "base",
      "md"
    ],
    "rules": [
      {
        "at": "base",
        "layout": "Container padding 48/24; h2 24/30 mt 48; body 15/24.",
        "properties": {
          "paddingYPx": 48,
          "bodyPx": 15
        },
        "evidence": "measured",
        "measuredFrom": [
          "CLONE_SPEC_PAGES.md:73"
        ]
      },
      {
        "at": "md",
        "layout": "Padding 80/32; h2 28/34 mt 64; body 16/26.",
        "properties": {
          "paddingYPx": 80,
          "bodyPx": 16
        },
        "evidence": "measured",
        "measuredFrom": [
          "CLONE_SPEC_PAGES.md:80"
        ]
      }
    ]
  },
  "blockCharLimits": {
    "h3": 50,
    "p": 1866,
    "li": 1248,
    "_evidence": [
      "CLONE_SPEC_PAGES.md:114",
      "CLONE_SPEC_PAGES.md:133",
      "CLONE_SPEC_PAGES.md:127",
      "CLONE_SPEC_PAGES.md:112"
    ]
  }
}
